{"_meta": {"api_version": "1", "contract_version": "1.15", "generated_at": "2026-07-22T01:57:35+00:00", "provenance": "socrata", "data_tier": "derived", "caveats": [{"code": "not_normalized_by_ridership", "text": "Crash counts are raw, not normalized by ridership (no public cyclist-volume data is joined yet), so busy corridors look worse than dangerous quiet ones."}], "license": "City of Chicago Data Portal Terms of Use (data.cityofchicago.org); derived analyses by On Your Left!", "attribution": "On Your Left! \u2014 Chicago bike safety, on the record (https://github.com/jartinator/chicago-safe-streets-data)", "human_page": "https://jartinator.github.io/chicago-safe-streets-data/table.html", "methodology": "https://jartinator.github.io/chicago-safe-streets-data/methodology.html", "schema": "https://jartinator.github.io/chicago-safe-streets-data/api/v1/schemas/wards-index.schema.json"}, "data_tier": "derived", "note": "comparable_danger_score is a 0-100 blend of each ward's percentile rank on crashes-per-10k-population and crashes-per-bikeway-mile (higher = more dangerous relative to other wards). Population is missing for wards not present in ward_demographics.json; bikeway_miles is 0 for wards with no mapped bike infrastructure, which lowers crashes_per_bikeway_mile's denominator and is a meaningful signal, not a data gap. Compared 2026-07-11 to 2026-07-22 (5 snapshots total). bikeway_pct_protected is the protected share of the ward's on-street (non-trail) bikeway miles; bikeway_pct_of_roads is the share of the ward's surface-street miles (see road_network.json) with any on-street bike infrastructure; both are null when the denominator is missing or zero. comparable_danger_score is a relative concern rank among wards, higher = worse \u2014 not absolute risk.", "wards": [{"ward": "42", "cyclist_crashes": 1105, "population": 72572.0, "bikeway_miles": 8.18, "crashes_per_10k_pop": 152.26, "crashes_per_bikeway_mile": 135.15, "comparable_danger_score": 96.0, "crash_trend": {"direction": "worsening", "window_end": "2026-07-20", "recent_12mo": 199, "prior_12mo": 161, "pct_change": 23.6}, "infra_growth_trend": {"miles_added": 0.0, "pct_growth": 0.0, "since": "2026-07-11", "by_category": {"protected": {"miles_added": 0.0, "pct_growth": 0.0}, "buffered": {"miles_added": 0.0, "pct_growth": 0.0}, "painted": {"miles_added": 0.0, "pct_growth": 0.0}, "sharrow": {"miles_added": 0.0, "pct_growth": 0.0}}}, "windows": {"recent_12mo": {"crashes": 199, "injury_crashes": 93, "ksi": 11, "fatal": 0}, "prior_12mo": {"crashes": 161, "injury_crashes": 69, "ksi": 8, "fatal": 1}, "window_end": "2026-07-20"}, "data_tier": "derived", "bikeway_pct_protected": 40.0, "road_miles": 37.36, "bikeway_pct_of_roads": 21.9, "detail_url": "https://jartinator.github.io/chicago-safe-streets-data/api/v1/wards/ward-42.json", "crashes_url": "https://jartinator.github.io/chicago-safe-streets-data/api/v1/crashes/ward-42.json"}, {"ward": "43", "cyclist_crashes": 652, "population": 53945.0, "bikeway_miles": 7.14, "crashes_per_10k_pop": 120.86, "crashes_per_bikeway_mile": 91.37, "comparable_danger_score": 88.8, "crash_trend": {"direction": "worsening", "window_end": "2026-07-14", "recent_12mo": 94, "prior_12mo": 86, "pct_change": 9.3}, "infra_growth_trend": {"miles_added": 0.0, "pct_growth": 0.0, "since": "2026-07-11", "by_category": {"protected": {"miles_added": 0.0, "pct_growth": 0.0}, "buffered": {"miles_added": 0.0, "pct_growth": 0.0}, "painted": {"miles_added": 0.0, "pct_growth": 0.0}, "greenway": {"miles_added": 0.0, "pct_growth": 0.0}, "sharrow": {"miles_added": 0.0, "pct_growth": 0.0}}}, "windows": {"recent_12mo": {"crashes": 91, "injury_crashes": 61, "ksi": 6, "fatal": 0}, "prior_12mo": {"crashes": 86, "injury_crashes": 54, "ksi": 6, "fatal": 0}, "window_end": "2026-07-20"}, "data_tier": "derived", "bikeway_pct_protected": 0.8, "road_miles": 40.64, "bikeway_pct_of_roads": 17.6, "detail_url": "https://jartinator.github.io/chicago-safe-streets-data/api/v1/wards/ward-43.json", "crashes_url": "https://jartinator.github.io/chicago-safe-streets-data/api/v1/crashes/ward-43.json"}, {"ward": "1", "cyclist_crashes": 819, "population": 56174.0, "bikeway_miles": 12.68, "crashes_per_10k_pop": 145.8, "crashes_per_bikeway_mile": 64.58, "comparable_danger_score": 87.8, "crash_trend": {"direction": "improving", "window_end": "2026-07-16", "recent_12mo": 114, "prior_12mo": 125, "pct_change": -8.8}, "infra_growth_trend": {"miles_added": 0.0, "pct_growth": 0.0, "since": "2026-07-11", "by_category": {"protected": {"miles_added": 0.0, "pct_growth": 0.0}, "buffered": {"miles_added": 0.0, "pct_growth": 0.0}, "painted": {"miles_added": 0.0, "pct_growth": 0.0}, "greenway": {"miles_added": 0.0, "pct_growth": 0.0}, "sharrow": {"miles_added": 0.0, "pct_growth": 0.0}}}, "windows": {"recent_12mo": {"crashes": 112, "injury_crashes": 59, "ksi": 10, "fatal": 0}, "prior_12mo": {"crashes": 126, "injury_crashes": 74, "ksi": 9, "fatal": 0}, "window_end": "2026-07-20"}, "data_tier": "derived", "bikeway_pct_protected": 16.2, "road_miles": 58.67, "bikeway_pct_of_roads": 21.6, "detail_url": "https://jartinator.github.io/chicago-safe-streets-data/api/v1/wards/ward-01.json", "crashes_url": "https://jartinator.github.io/chicago-safe-streets-data/api/v1/crashes/ward-01.json"}, {"ward": "34", "cyclist_crashes": 661, "population": 46071.0, "bikeway_miles": 9.58, "crashes_per_10k_pop": 143.47, "crashes_per_bikeway_mile": 68.97, "comparable_danger_score": 87.8, "crash_trend": {"direction": "flat", "window_end": "2026-07-17", "recent_12mo": 105, "prior_12mo": 105, "pct_change": 0.0}, "infra_growth_trend": {"miles_added": 0.0, "pct_growth": 0.0, "since": "2026-07-11", "by_category": {"protected": {"miles_added": 0.0, "pct_growth": 0.0}, "buffered": {"miles_added": 0.0, "pct_growth": 0.0}, "painted": {"miles_added": 0.0, "pct_growth": 0.0}, "sharrow": {"miles_added": 0.0, "pct_growth": 0.0}}}, "windows": {"recent_12mo": {"crashes": 105, "injury_crashes": 44, "ksi": 4, "fatal": 0}, "prior_12mo": {"crashes": 105, "injury_crashes": 49, "ksi": 5, "fatal": 0}, "window_end": "2026-07-20"}, "data_tier": "derived", "bikeway_pct_protected": 56.3, "road_miles": 32.65, "bikeway_pct_of_roads": 29.4, "detail_url": "https://jartinator.github.io/chicago-safe-streets-data/api/v1/wards/ward-34.json", "crashes_url": "https://jartinator.github.io/chicago-safe-streets-data/api/v1/crashes/ward-34.json"}, {"ward": "44", "cyclist_crashes": 586, "population": 55020.0, "bikeway_miles": 6.4, "crashes_per_10k_pop": 106.51, "crashes_per_bikeway_mile": 91.59, "comparable_danger_score": 87.8, "crash_trend": {"direction": "worsening", "window_end": "2026-07-15", "recent_12mo": 98, "prior_12mo": 73, "pct_change": 34.2}, "infra_growth_trend": {"miles_added": 0.0, "pct_growth": 0.0, "since": "2026-07-11", "by_category": {"protected": {"miles_added": 0.0, "pct_growth": 0.0}, "buffered": {"miles_added": 0.0, "pct_growth": 0.0}, "painted": {"miles_added": 0.0, "pct_growth": 0.0}, "greenway": {"miles_added": 0.0, "pct_growth": 0.0}, "sharrow": {"miles_added": 0.0, "pct_growth": 0.0}}}, "windows": {"recent_12mo": {"crashes": 97, "injury_crashes": 54, "ksi": 7, "fatal": 0}, "prior_12mo": {"crashes": 73, "injury_crashes": 40, "ksi": 7, "fatal": 0}, "window_end": "2026-07-20"}, "data_tier": "derived", "bikeway_pct_protected": 0.0, "road_miles": 32.77, "bikeway_pct_of_roads": 19.5, "detail_url": "https://jartinator.github.io/chicago-safe-streets-data/api/v1/wards/ward-44.json", "crashes_url": "https://jartinator.github.io/chicago-safe-streets-data/api/v1/crashes/ward-44.json"}, {"ward": "27", "cyclist_crashes": 1197, "population": 67920.0, "bikeway_miles": 25.65, "crashes_per_10k_pop": 176.24, "crashes_per_bikeway_mile": 46.66, "comparable_danger_score": 81.7, "crash_trend": {"direction": "worsening", "window_end": "2026-07-20", "recent_12mo": 199, "prior_12mo": 160, "pct_change": 24.4}, "infra_growth_trend": {"miles_added": 0.0, "pct_growth": 0.0, "since": "2026-07-11", "by_category": {"protected": {"miles_added": 0.0, "pct_growth": 0.0}, "buffered": {"miles_added": 0.0, "pct_growth": 0.0}, "painted": {"miles_added": 0.0, "pct_growth": 0.0}, "greenway": {"miles_added": 0.0, "pct_growth": 0.0}, "sharrow": {"miles_added": 0.0, "pct_growth": 0.0}}}, "windows": {"recent_12mo": {"crashes": 199, "injury_crashes": 90, "ksi": 15, "fatal": 0}, "prior_12mo": {"crashes": 160, "injury_crashes": 85, "ksi": 9, "fatal": 0}, "window_end": "2026-07-20"}, "data_tier": "derived", "bikeway_pct_protected": 31.7, "road_miles": 120.94, "bikeway_pct_of_roads": 21.2, "detail_url": "https://jartinator.github.io/chicago-safe-streets-data/api/v1/wards/ward-27.json", "crashes_url": "https://jartinator.github.io/chicago-safe-streets-data/api/v1/crashes/ward-27.json"}, {"ward": "46", "cyclist_crashes": 516, "population": 46849.0, "bikeway_miles": 8.19, "crashes_per_10k_pop": 110.14, "crashes_per_bikeway_mile": 62.98, "comparable_danger_score": 81.7, "crash_trend": {"direction": "flat", "window_end": "2026-07-18", "recent_12mo": 81, "prior_12mo": 81, "pct_change": 0.0}, "infra_growth_trend": {"miles_added": 0.0, "pct_growth": 0.0, "since": "2026-07-11", "by_category": {"protected": {"miles_added": 0.0, "pct_growth": 0.0}, "buffered": {"miles_added": 0.0, "pct_growth": 0.0}, "painted": {"miles_added": 0.0, "pct_growth": 0.0}, "greenway": {"miles_added": 0.0, "pct_growth": 0.0}, "sharrow": {"miles_added": 0.0, "pct_growth": 0.0}}}, "windows": {"recent_12mo": {"crashes": 81, "injury_crashes": 50, "ksi": 6, "fatal": 0}, "prior_12mo": {"crashes": 80, "injury_crashes": 42, "ksi": 3, "fatal": 0}, "window_end": "2026-07-20"}, "data_tier": "derived", "bikeway_pct_protected": 19.5, "road_miles": 30.03, "bikeway_pct_of_roads": 27.3, "detail_url": "https://jartinator.github.io/chicago-safe-streets-data/api/v1/wards/ward-46.json", "crashes_url": "https://jartinator.github.io/chicago-safe-streets-data/api/v1/crashes/ward-46.json"}, {"ward": "2", "cyclist_crashes": 479, "population": 58472.